{
    "name":  "standard-governance",
    "version":  "1.8.11",
    "content_hash":  "979eb29b45e49e96642b3512dfb327b3e8169b044a823be1cd20a0c57aade92e",
    "installed_at":  "2026-10-08T11:43:05.0326133+09:00",
    "status":  "complete",
    "counts":  {
                   "installed":  187,
                   "kept":  6,
                   "conflict":  0,
                   "skipped":  0
               },
    "preserve":  [
                     "contracts/project.yaml",
                     ".harness/control/casan-policies.yaml",
                     ".harness/control/risk-policy.yaml",
                     ".harness/eval/golden/golden-cases.jsonl",
                     ".harness/control/token-pricing.json",
                     ".harness/control/sensitive-paths.json",
                     ".harness/control/agent-config.yaml",
                     "contracts/impact-map.yaml"
                 ],
    "files":  [
                  {
                      "path":  ".claude/agents/README.md",
                      "sha256":  "deb0d3d8eddae9560b8671743308aebede57bbc36bfbc821c0a4779d64770a1b",
                      "installed_sha256":  "deb0d3d8eddae9560b8671743308aebede57bbc36bfbc821c0a4779d64770a1b",
                      "state":  "installed"
                  },
                  {
                      "path":  ".claude/agents/analyst.md",
                      "sha256":  "18fb50df7621e625d4dc29da356f3e4d0d027bf019b66d2547fb402258a541c5",
                      "installed_sha256":  "18fb50df7621e625d4dc29da356f3e4d0d027bf019b66d2547fb402258a541c5",
                      "state":  "installed"
                  },
                  {
                      "path":  ".claude/agents/architect.md",
                      "sha256":  "50b4df19f98ce5d3186b747fb8206c0667812ab1ba6f259c2965c910d13b8972",
                      "installed_sha256":  "50b4df19f98ce5d3186b747fb8206c0667812ab1ba6f259c2965c910d13b8972",
                      "state":  "installed"
                  },
                  {
                      "path":  ".claude/agents/boss.md",
                      "sha256":  "9841f91107b0ae9b9d07562fb7a662aba386b0586333199e6dede56c86ee9a1b",
                      "installed_sha256":  "9841f91107b0ae9b9d07562fb7a662aba386b0586333199e6dede56c86ee9a1b",
                      "state":  "installed"
                  },
                  {
                      "path":  ".claude/agents/code-reviewer.md",
                      "sha256":  "3be54def85d141c4a6461211315b0ce815709e479a79cf78a5695b2f6f5ee5b1",
                      "installed_sha256":  "3be54def85d141c4a6461211315b0ce815709e479a79cf78a5695b2f6f5ee5b1",
                      "state":  "installed"
                  },
                  {
                      "path":  ".claude/agents/developer.md",
                      "sha256":  "188eff7d35908a341604d80946c2ee2915a3b5afedd80bf21430cf218a8f6440",
                      "installed_sha256":  "188eff7d35908a341604d80946c2ee2915a3b5afedd80bf21430cf218a8f6440",
                      "state":  "installed"
                  },
                  {
                      "path":  ".claude/agents/devops.md",
                      "sha256":  "eacfb62ead105ab018f4b27c441f9eaedcfc7d424b55d4be4ba1a0aeeeac74be",
                      "installed_sha256":  "eacfb62ead105ab018f4b27c441f9eaedcfc7d424b55d4be4ba1a0aeeeac74be",
                      "state":  "installed"
                  },
                  {
                      "path":  ".claude/agents/fix-agent.md",
                      "sha256":  "2eddf37f791750381a732cce8121391cfd447fdc0a0b5eb586473ce8846f0d7d",
                      "installed_sha256":  "2eddf37f791750381a732cce8121391cfd447fdc0a0b5eb586473ce8846f0d7d",
                      "state":  "installed"
                  },
                  {
                      "path":  ".claude/agents/gatekeeper.md",
                      "sha256":  "7101785b8460e553a795a58e91b6ceee902dd079dba5eb3a339b8182e3f11b48",
                      "installed_sha256":  "7101785b8460e553a795a58e91b6ceee902dd079dba5eb3a339b8182e3f11b48",
                      "state":  "installed"
                  },
                  {
                      "path":  ".claude/agents/impact-analyzer.md",
                      "sha256":  "22c284640f926d4d5950a68d3c9dc2cd0cc3f784013280e4137d22abaa172bcb",
                      "installed_sha256":  "22c284640f926d4d5950a68d3c9dc2cd0cc3f784013280e4137d22abaa172bcb",
                      "state":  "installed"
                  },
                  {
                      "path":  ".claude/agents/qa-reviewer.md",
                      "sha256":  "5b0dc59c9fc87c7111107b7c68eb5a511ff067d36684f04a767e8db7279da7da",
                      "installed_sha256":  "5b0dc59c9fc87c7111107b7c68eb5a511ff067d36684f04a767e8db7279da7da",
                      "state":  "installed"
                  },
                  {
                      "path":  ".claude/agents/researcher.md",
                      "sha256":  "9ce3ce87c93cd243d420212f1c9dbd0312cb5d52466ab57b5c104e4eb04081c6",
                      "installed_sha256":  "9ce3ce87c93cd243d420212f1c9dbd0312cb5d52466ab57b5c104e4eb04081c6",
                      "state":  "installed"
                  },
                  {
                      "path":  ".claude/agents/reviewer.md",
                      "sha256":  "aa817a1f0bb2acd9cc3177920aae7a4f1997ce6aa005d2095e1917fe21457da8",
                      "installed_sha256":  "aa817a1f0bb2acd9cc3177920aae7a4f1997ce6aa005d2095e1917fe21457da8",
                      "state":  "installed"
                  },
                  {
                      "path":  ".claude/agents/targeted-tester.md",
                      "sha256":  "1ddc488f3e3c9f0f1f3f3352c39d9c099db7bf3653bfc11a95fa45ba6fa43691",
                      "installed_sha256":  "1ddc488f3e3c9f0f1f3f3352c39d9c099db7bf3653bfc11a95fa45ba6fa43691",
                      "state":  "installed"
                  },
                  {
                      "path":  ".claude/agents/tester.md",
                      "sha256":  "e5da5112d52f40fcf711abec296d7ee9800d0ff077c17998b7249b8b91712873",
                      "installed_sha256":  "e5da5112d52f40fcf711abec296d7ee9800d0ff077c17998b7249b8b91712873",
                      "state":  "installed"
                  },
                  {
                      "path":  ".claude/agents/writer.md",
                      "sha256":  "4591cbc4351b12adf129ef55de3261949a165bb870e128fc84ecc5bdf072a1ab",
                      "installed_sha256":  "4591cbc4351b12adf129ef55de3261949a165bb870e128fc84ecc5bdf072a1ab",
                      "state":  "installed"
                  },
                  {
                      "path":  ".claude/settings.json",
                      "sha256":  "328c2d0ebc85176f4de4192155c9f18300dece05b6b3690917aea270242c00f1",
                      "installed_sha256":  "32141930eb20896db3f57e957f6c85df4483bbf5ad53ff212c0a885d053eb211",
                      "state":  "installed"
                  },
                  {
                      "path":  ".claude/settings.posix.json",
                      "sha256":  "5698b4788831debb26a9f58b23224f92589569e016e911159c2dc13c5eaf6e77",
                      "installed_sha256":  "1274d43d3ee259be5a96cd54cac81869bb6d711126073c07223efc59b1507f1c",
                      "state":  "installed"
                  },
                  {
                      "path":  ".claude/skills/.gitkeep",
                      "sha256":  "unknown",
                      "installed_sha256":  "unknown",
                      "state":  "installed"
                  },
                  {
                      "path":  ".claude/skills/README.md",
                      "sha256":  "4a08dd3e53948cb716b3737edecf1ea51ba8473d7baf218ae215e5390c5e4869",
                      "installed_sha256":  "4a08dd3e53948cb716b3737edecf1ea51ba8473d7baf218ae215e5390c5e4869",
                      "state":  "installed"
                  },
                  {
                      "path":  ".claude/skills/analyze-requirements/SKILL.md",
                      "sha256":  "833c4671fc8f99f58ffe629b9ad1259026089b5a85814e14e6214b076d167d42",
                      "installed_sha256":  "833c4671fc8f99f58ffe629b9ad1259026089b5a85814e14e6214b076d167d42",
                      "state":  "installed"
                  },
                  {
                      "path":  ".claude/skills/be-fe-security-audit/SKILL.md",
                      "sha256":  "d7d4c83ed288dcb461b3fa94bfec41e06e093fa897e55baaadad710e8e5fe557",
                      "installed_sha256":  "d7d4c83ed288dcb461b3fa94bfec41e06e093fa897e55baaadad710e8e5fe557",
                      "state":  "installed"
                  },
                  {
                      "path":  ".claude/skills/commit-deploy-log/SKILL.md",
                      "sha256":  "4b3f88e5f6f16f06c84692735621b59944c531c85dfcc0fab1dfac379c76acaf",
                      "installed_sha256":  "4b3f88e5f6f16f06c84692735621b59944c531c85dfcc0fab1dfac379c76acaf",
                      "state":  "installed"
                  },
                  {
                      "path":  ".claude/skills/deep-research/SKILL.md",
                      "sha256":  "0b63db7cbdf3d7e3e9063b50f38dd07b17d648a9a4b9315d8b406936798098d0",
                      "installed_sha256":  "0b63db7cbdf3d7e3e9063b50f38dd07b17d648a9a4b9315d8b406936798098d0",
                      "state":  "installed"
                  },
                  {
                      "path":  ".claude/skills/deploy-to-test/SKILL.md",
                      "sha256":  "3b802326309450bc51a296ce36a3366835d1bd2eb3a74b4c42403171233d9d04",
                      "installed_sha256":  "3b802326309450bc51a296ce36a3366835d1bd2eb3a74b4c42403171233d9d04",
                      "state":  "installed"
                  },
                  {
                      "path":  ".claude/skills/evidence-bundle/SKILL.md",